Nama Produk,Review,Nama Akun,Rating User,Ulasan Produk,Waktu Review,Varian Produk
SteelSeries Rival 3 - Gaming Mouse,1,G***e,bintang 5,berfungsi baik,6 bulan lalu,none
SteelSeries Rival 3 - Gaming Mouse,2,R***n,bintang 5,overall puas tapi LOD nya lumayan tinggi (disarankan pake mousepad tebal),9 bulan lalu,none
SteelSeries Rival 3 - Gaming Mouse,3,Dicky,bintang 5,"performa ok, mantap barangnya cepat sampai",Lebih dari 1 tahun lalu,none
SteelSeries Rival 3 - Gaming Mouse,4,Chandra,bintang 5,"Desain minimalis, Feel tombolnya enak dan gak terlalu berisik setiap klik. Pengaturan melalui aplikasi SteelSeries GG sangat mumpuni, semua tombol bisa di-custom dan bisa...",Lebih dari 1 tahun lalu,none
SteelSeries Rival 3 - Gaming Mouse,5,arif,bintang 5,thankss,Lebih dari 1 tahun lalu,none
SteelSeries Rival 3 - Gaming Mouse,6,gusmi,bintang 5,"respon kenceng dan ramah, packingnya bagus. klo dilihat sekilas pasti hampir g ada beda sama versi murahnya rival 95, tapi pas digenggam dan dipencet baru berasa, kabel l...",Lebih dari 1 tahun lalu,none
SteelSeries Rival 3 - Gaming Mouse,7,Arief,bintang 5,Admin jelas fast response.. lalu dalam membuat keterangan ppada produknya jg jelas sehingga tidak perlu tanya lg tinggal gas beli.. barnag dikirim dg baik secara kemasa...,Lebih dari 1 tahun lalu,none
SteelSeries Rival 3 - Gaming Mouse,8,Toserba,bintang 5,none,Lebih dari 1 tahun lalu,none
SteelSeries Rival 3 - Gaming Mouse,9,D***n,bintang 5,the best sih kalau urusan gear 💪🏻,Lebih dari 1 tahun lalu,none
SteelSeries Rival 3 - Gaming Mouse,10,Nahla,bintang 5,"mousenya pendek bagi saya, sama pencetan tombol jempol terlalu kecil",Lebih dari 1 tahun lalu,none
SteelSeries Rival 3 - Gaming Mouse,11,Samuel,bintang 5,produk berfungsi dengan normal dan ori,Lebih dari 1 tahun lalu,none
SteelSeries Rival 3 - Gaming Mouse,12,Maximilianus,bintang 5,"barang sesuai deskripsi, pengiriman cepat dan packaging aman",Lebih dari 1 tahun lalu,none
SteelSeries Rival 3 - Gaming Mouse,13,G***n,bintang 5,"barang mantap, respons super cepat",Lebih dari 1 tahun lalu,none
SteelSeries Rival 3 - Gaming Mouse,14,Emir,bintang 5,Gila mantep bgt ni barangg,Lebih dari 1 tahun lalu,none
SteelSeries Rival 3 - Gaming Mouse,15,Fabian,bintang 5,sexual harapan ;),Lebih dari 1 tahun lalu,none
SteelSeries Rival 3 - Gaming Mouse,16,Nuruddin,bintang 5,"mantap gan, packingnya rapih, aman semua, dapet voucher juga dan dikasih gelang mantap banget. semoga barangnya awet juga",Lebih dari 1 tahun lalu,none
SteelSeries Rival 3 - Gaming Mouse,17,Trianto,bintang 5,"barang sampai tujuang dengan aman,respon cepat dan ramah",Lebih dari 1 tahun lalu,none
SteelSeries Rival 3 - Gaming Mouse,18,Fiona,bintang 5,bagus barang nya belom di coba tapi,Lebih dari 1 tahun lalu,none
SteelSeries Rival 3 - Gaming Mouse,19,D***n,bintang 5,"seller fast respond, diproses cepat, box mulus dan produk berfungsi dengan baik.",Lebih dari 1 tahun lalu,none
SteelSeries Rival 3 - Gaming Mouse,20,a***h,bintang 5,"barang bagus, lebih kecil dari rival 310 tapi performa kurang lebih sama, rekomended banget",Lebih dari 1 tahun lalu,none
SteelSeries Rival 3 - Gaming Mouse,21,Yoga,bintang 5,"Untuk kualitas produk tidak perlu diragukan, asal pemakaian apik 5 tahun masih oke. Tombolnya empuk terutama bagian makro, karna terbiasa dengan dengan tombol makro yang...",Lebih dari 1 tahun lalu,none
