Nama Produk,Review,Nama Akun,Rating User,Ulasan Produk,Waktu Review,Varian Produk
LOGITECH G333 / G-333 In-Ears Headphone with Mic - Gaming Headset - PURPLE,1,A***n,bintang 4,"Hmm suaranya terbilang ok, tapi menurut saya masih kalah dengan earbud apple. Sama kalau lagi ga ada output suara, ad suara kresek” nya sedikit",2 bulan lalu,Varian: BLACK
LOGITECH G333 / G-333 In-Ears Headphone with Mic - Gaming Headset - PURPLE,2,Y***s,bintang 5,Barang sesuai deskripsi dan berfungsi dengan baik,3 bulan lalu,Varian: PURPLE
LOGITECH G333 / G-333 In-Ears Headphone with Mic - Gaming Headset - PURPLE,3,H***h,bintang 5,Good.. 👍,3 bulan lalu,Varian: BLACK
LOGITECH G333 / G-333 In-Ears Headphone with Mic - Gaming Headset - PURPLE,4,Ragnar,bintang 5,"barang sampai dengan selamat, admin nya the best, sempat ada kendala dengan kurir gosend, dari jam 10 sampai jam 6 malam tidak dapat2, tapi admin nya berusaha buat nyarii...",Lebih dari 1 tahun lalu,Varian: PURPLE
LOGITECH G333 / G-333 In-Ears Headphone with Mic - Gaming Headset - PURPLE,5,Steven,bintang 5,"Sound mantap, pengiriman cepat, packing rapih mantap 👍👍",Lebih dari 1 tahun lalu,Varian: PURPLE
LOGITECH G333 / G-333 In-Ears Headphone with Mic - Gaming Headset - PURPLE,6,Mario,bintang 5,Mantap sekali,Lebih dari 1 tahun lalu,Varian: BLACK
LOGITECH G333 / G-333 In-Ears Headphone with Mic - Gaming Headset - PURPLE,7,Akhmad,bintang 5,"suara earphonenya oke banget, respon seller juga cepat",Lebih dari 1 tahun lalu,Varian: BLACK
LOGITECH G333 / G-333 In-Ears Headphone with Mic - Gaming Headset - PURPLE,8,Bambang,bintang 5,recommended seller.... fast response.. tq gan,Lebih dari 1 tahun lalu,Varian: WHITE
LOGITECH G333 / G-333 In-Ears Headphone with Mic - Gaming Headset - PURPLE,9,Sri,bintang 5,"Build quality sama warna bagus, untuk suara menurut saya B banget (selera masing2 beda), ada mic nya dan tombol di mic bisa untuk play/pause dan lagu berikutnya/sebelumny...",Lebih dari 1 tahun lalu,Varian: PURPLE
LOGITECH G333 / G-333 In-Ears Headphone with Mic - Gaming Headset - PURPLE,10,Jessen,bintang 5,"pelayanan cepat dan ramah, barang bagus. udah coba di ps5 ok 👌🏻 mic jg normal. semoga ga ada problem kedepannya. warna ungunya unik dibanding item / putih kayanya pasar...",Lebih dari 1 tahun lalu,Varian: PURPLE
LOGITECH G333 / G-333 In-Ears Headphone with Mic - Gaming Headset - PURPLE,11,Amadeus,bintang 5,mantap packaging rapih cepat sampai,Lebih dari 1 tahun lalu,Varian: WHITE
LOGITECH G333 / G-333 In-Ears Headphone with Mic - Gaming Headset - PURPLE,12,A***e,bintang 4,Barang pertama defect. Menunggu garansi dari ggs,Lebih dari 1 tahun lalu,Varian: BLACK
LOGITECH G333 / G-333 In-Ears Headphone with Mic - Gaming Headset - PURPLE,13,Hikmah,bintang 5,Barang sampai dengan aman dan sesuai pesanan. Terima kasih,Lebih dari 1 tahun lalu,Varian: BLACK
LOGITECH G333 / G-333 In-Ears Headphone with Mic - Gaming Headset - PURPLE,14,edric,bintang 5,keren,Lebih dari 1 tahun lalu,Varian: WHITE
LOGITECH G333 / G-333 In-Ears Headphone with Mic - Gaming Headset - PURPLE,15,rezky,bintang 5,barang sudah sampai ggs selalu di hati,Lebih dari 1 tahun lalu,Varian: PURPLE
LOGITECH G333 / G-333 In-Ears Headphone with Mic - Gaming Headset - PURPLE,16,D***d,bintang 5,MANTAP BANAR,Lebih dari 1 tahun lalu,Varian: PURPLE
