Nama Produk,Review,Nama Akun,Rating User,Ulasan Produk,Waktu Review,Varian Produk
Ducky One 3 Daybreak Mini RGB - Gaming Keyboard - Black Switch,1,k***n,bintang 5,Barang sangat bagus,Lebih dari 1 tahun lalu,Varian: Clear Switch
Ducky One 3 Daybreak Mini RGB - Gaming Keyboard - Black Switch,2,Ferdyanto,bintang 5,Best key,Lebih dari 1 tahun lalu,Varian: Red Switch
Ducky One 3 Daybreak Mini RGB - Gaming Keyboard - Black Switch,3,Muhammad,bintang 5,GG geming,Lebih dari 1 tahun lalu,Varian: Silent Red
Ducky One 3 Daybreak Mini RGB - Gaming Keyboard - Black Switch,4,Edward,bintang 5,"Mantap, pengiriman cepat rapih packingnya barang berfungsi dengan baik. Sukses terus yaaa",Lebih dari 1 tahun lalu,Varian: Silent Red
Ducky One 3 Daybreak Mini RGB - Gaming Keyboard - Black Switch,5,fahru,bintang 5,pengiriman cepat,Lebih dari 1 tahun lalu,Varian: Black Switch
Ducky One 3 Daybreak Mini RGB - Gaming Keyboard - Black Switch,6,S***h,bintang 5,"👍👍 mantabbb dah..., buat kado anak dan anaknya happy bingitss... keyboard cakep, pelayanan cakeppp, delivery cakeppp...",Lebih dari 1 tahun lalu,Varian: Silent Red
Ducky One 3 Daybreak Mini RGB - Gaming Keyboard - Black Switch,7,Alexander,bintang 5,"Bahan nya plastik jd ringan modelnya bagus,",Lebih dari 1 tahun lalu,Varian: Blue Switch
Ducky One 3 Daybreak Mini RGB - Gaming Keyboard - Black Switch,8,d***i,bintang 5,kenapa air laut itu asin?,Lebih dari 1 tahun lalu,Varian: Red Switch
Ducky One 3 Daybreak Mini RGB - Gaming Keyboard - Black Switch,9,Hadi,bintang 5,"Sesuai dengan deskripsi, sudah di tes berfungsi dengan baik, tidak ada cacat, packing aman, cepat sampai…. penjual sangat kooperatif & fast respon. Recommended seller",Lebih dari 1 tahun lalu,Varian: Blue Switch
Ducky One 3 Daybreak Mini RGB - Gaming Keyboard - Black Switch,10,Artha,bintang 5,"nice, butuh adaptasi biasa make tkl jadi 60% gegara meja kecil :(",Lebih dari 1 tahun lalu,Varian: Speed Silver
Ducky One 3 Daybreak Mini RGB - Gaming Keyboard - Black Switch,11,Ramadan,bintang 5,"compact, feelnya luar biasa mantap, dan berasa clean di meja",Lebih dari 1 tahun lalu,Varian: Red Switch
Ducky One 3 Daybreak Mini RGB - Gaming Keyboard - Black Switch,12,Muahmmad,bintang 5,Barang bagus dan pegantaran cepat,Lebih dari 1 tahun lalu,Varian: Speed Silver
Ducky One 3 Daybreak Mini RGB - Gaming Keyboard - Black Switch,13,Fatzri,bintang 5,"Bagus sesuai pesanan, full senyum.",Lebih dari 1 tahun lalu,Varian: Silent Red
Ducky One 3 Daybreak Mini RGB - Gaming Keyboard - Black Switch,14,James,bintang 5,Packaging masih utuh dan bersih,Lebih dari 1 tahun lalu,Varian: Blue Switch
Ducky One 3 Daybreak Mini RGB - Gaming Keyboard - Black Switch,15,Alfariza,bintang 5,bagus bre,Lebih dari 1 tahun lalu,Varian: Blue Switch
