Nama Produk,Review,Nama Akun,Rating User,Ulasan Produk,Waktu Review,Varian Produk
Akko CS Silver - Mechanical Keyboard Switch,1,Wisnu,bintang 5,none,1 bulan lalu,none
Akko CS Silver - Mechanical Keyboard Switch,2,Iqbal,bintang 5,gacor kang,7 bulan lalu,none
Akko CS Silver - Mechanical Keyboard Switch,3,Kartiko,bintang 4,"ternyata bukan prelube, tapi udah cukup kalo standarmu gak ketinggian wkwk. kalo saya mah mending di lube aja",7 bulan lalu,none
Akko CS Silver - Mechanical Keyboard Switch,4,joseph,bintang 5,mantap pengiriman cepat barang ok,8 bulan lalu,none
Akko CS Silver - Mechanical Keyboard Switch,5,Auzi,bintang 5,"Gak akan kelihatan di sini sih, tapi suaranya pas dengan yang saya mau.",8 bulan lalu,none
Akko CS Silver - Mechanical Keyboard Switch,6,Ade,bintang 5,"terbaik pretravelnya cepet cocok untuk game, karna linear jdi neken tombol lama2 pun ga pegel tangan.",10 bulan lalu,none
Akko CS Silver - Mechanical Keyboard Switch,7,Christian,bintang 5,"Packaging nya aman, dan barang kondisi bagus",Lebih dari 1 tahun lalu,none
Akko CS Silver - Mechanical Keyboard Switch,8,M***l,bintang 5,"Kotak sayangnya agak penyok"", tapi ya kotak doang. Switch udah dipasang keyboard dan aman berfungsi semua. Enak dipencet. namun karena aktuasinya pendek jadi kadang...",Lebih dari 1 tahun lalu,none
Akko CS Silver - Mechanical Keyboard Switch,9,F***k,bintang 5,Goodgaming good service,Lebih dari 1 tahun lalu,none
Akko CS Silver - Mechanical Keyboard Switch,10,farist,bintang 5,happy customer 😚,Lebih dari 1 tahun lalu,none
Akko CS Silver - Mechanical Keyboard Switch,11,J***n,bintang 5,respon cepat. good,Lebih dari 1 tahun lalu,none
Akko CS Silver - Mechanical Keyboard Switch,12,Bernard,bintang 5,Got the item in good condition. Received within 3 days of order.,Lebih dari 1 tahun lalu,none
Akko CS Silver - Mechanical Keyboard Switch,13,Josep,bintang 5,"Seller cepat tanggap & ramah Packing rapi, pengiriman tepat waktu Barang sesuai order.. semoga awet",Lebih dari 1 tahun lalu,none
Akko CS Silver - Mechanical Keyboard Switch,14,Bernard,bintang 5,Received items within a week. Well packed and items came in good condition. Happy to purchase from this seller.,Lebih dari 1 tahun lalu,none
Akko CS Silver - Mechanical Keyboard Switch,15,Fariz,bintang 5,mantep packing rapi,Lebih dari 1 tahun lalu,none
Akko CS Silver - Mechanical Keyboard Switch,16,v***t,bintang 5,"45g linear, tanpa lube udh smooth bgt dan ga perlu kasih film krn udh tight bgt. Kadang suka kepencet sendiri karena terlalu ringan",Lebih dari 1 tahun lalu,none
Akko CS Silver - Mechanical Keyboard Switch,17,Hario,bintang 5,Pesanan sudah diterima dengan baik dan sesuai. Terima kasih.,Lebih dari 1 tahun lalu,none
Akko CS Silver - Mechanical Keyboard Switch,18,F***y,bintang 5,"Barangnya oke banget, pelayanannya juga mantap.",Lebih dari 1 tahun lalu,none
