Nama Produk,Review,Nama Akun,Rating User,Ulasan Produk,Waktu Review,Varian Produk
Tecware Keyboard Wristpad - Full,1,Kevin,bintang 5,Enak banget buat nge-game.,Lebih dari 1 tahun lalu,Varian: TKL
Tecware Keyboard Wristpad - Full,2,Samuel,bintang 5,"Untuk perpaduan gaming dan ketik, yg switch coklat paling pas. biru untuk ketik, merah untuk murni gaming. TLK enak kalau untuk keduanya asalkan ga masukkan angka ke exce...",Lebih dari 1 tahun lalu,Varian: TKL
Tecware Keyboard Wristpad - Full,3,D***l,bintang 4,"Respon ramah, cepat, packing rapih, pelayanan memuaskan. Kenyamanan dari produk jujur agak kurang, balik lg ada harga ada kualitas. Mending sekalian beli yg bagusan deh...",Lebih dari 1 tahun lalu,Varian: Full
Tecware Keyboard Wristpad - Full,4,Rizky,bintang 5,produknya bagus,Lebih dari 1 tahun lalu,Varian: Full
Tecware Keyboard Wristpad - Full,5,O***i,bintang 5,"Nyaman, empuk dan pas bgt di tangan. Minus nya cuma gampang ketempelan debu/rambut/bulu binatang. Harus rajin bersihin aja",Lebih dari 1 tahun lalu,Varian: Full
Tecware Keyboard Wristpad - Full,6,L***a,bintang 4,"Tidak mulus, ada lekuk an. Pengiriman terkendala ada 2 hari an dikarenakan alasan overload. Didalam paket, dikasih bonus gantungan kunci lucu.",Lebih dari 1 tahun lalu,Varian: Full
Tecware Keyboard Wristpad - Full,7,A***w,bintang 5,"Mantap.... admin ramah, pengiriman cepat",Lebih dari 1 tahun lalu,Varian: TKL
Tecware Keyboard Wristpad - Full,8,Adiyat,bintang 5,"Seller ramah. Untuk produknya, tadinya expect bakal empuk gitu bantalannya, ternyata agak keras. Overall oke, better than nothing lah ya..",Lebih dari 1 tahun lalu,Varian: Full
Tecware Keyboard Wristpad - Full,9,ronald,bintang 5,Nice,Lebih dari 1 tahun lalu,Varian: TKL
