Nama Produk,Review,Nama Akun,Rating User,Ulasan Produk,Waktu Review,Varian Produk
Rexus KM9 / KM-9 Combo Bundle Keyboard & Mouse Wireless - Pink,1,Andri,bintang 4,"Barang yg dipesan bagus, kualitas ok. Pengirimannya yg lama walaupun melalui GoSend-Sameday 8jam",2 bulan lalu,Varian: Pink
Rexus KM9 / KM-9 Combo Bundle Keyboard & Mouse Wireless - Pink,2,A***n,bintang 5,"response seller cepat, barang ok.",10 bulan lalu,Varian: White
Rexus KM9 / KM-9 Combo Bundle Keyboard & Mouse Wireless - Pink,3,Yosua,bintang 5,"Mantap keyboard, respon cepat. Ditingkatkan lagi kecepatannya ya gan! Recommended",Lebih dari 1 tahun lalu,Varian: White
Rexus KM9 / KM-9 Combo Bundle Keyboard & Mouse Wireless - Pink,4,A***y,bintang 5,"Suaranya tidak cempreng/berisik, semuanya berfungsi dengan baik, warnanya juga oke banget, worth it.",Lebih dari 1 tahun lalu,Varian: White
Rexus KM9 / KM-9 Combo Bundle Keyboard & Mouse Wireless - Pink,5,A***s,bintang 5,kurirnya ngaco dah.. store ok,Lebih dari 1 tahun lalu,Varian: Blue Mint
Rexus KM9 / KM-9 Combo Bundle Keyboard & Mouse Wireless - Pink,6,Fransiscus,bintang 5,Barang sampai dengan baik. Terima kasih,Lebih dari 1 tahun lalu,Varian: Blue Mint
Rexus KM9 / KM-9 Combo Bundle Keyboard & Mouse Wireless - Pink,7,Indah,bintang 5,"sellernya ramah, keyboard and mouse nya bagus bangettt🖤 keyboard nya ada beratnya gitu jd kesannya tuu classy banget. sukak🤍 untuk fungsi nya blum tau soalnya lg mau be...",Lebih dari 1 tahun lalu,Varian: White
Rexus KM9 / KM-9 Combo Bundle Keyboard & Mouse Wireless - Pink,8,F***h,bintang 5,"Paket nyampe dg selamat, packing rapih barang sudah dicoba dan jadi, box penyok dikit untung masih aman. Terimakasih masbro",Lebih dari 1 tahun lalu,Varian: Blue Mint
Rexus KM9 / KM-9 Combo Bundle Keyboard & Mouse Wireless - Pink,9,Ian,bintang 5,nice produk,Lebih dari 1 tahun lalu,Varian: Blue Mint
Rexus KM9 / KM-9 Combo Bundle Keyboard & Mouse Wireless - Pink,10,Danindra,bintang 5,biang,Lebih dari 1 tahun lalu,Varian: Blue Mint
Rexus KM9 / KM-9 Combo Bundle Keyboard & Mouse Wireless - Pink,11,Retno,bintang 5,"Barang original,warna real pict,keyboadnya belum ada baterainya jadi belum bisa dicoba, suka banget model keyboadnya. terimakasih seller , kurir & tokped",Lebih dari 1 tahun lalu,Varian: Blue Mint
Rexus KM9 / KM-9 Combo Bundle Keyboard & Mouse Wireless - Pink,12,A***n,bintang 5,"responae toko ok bgt. oengiriman juga cepat. keyboardnya berfungsi dgn baik. material bagus, sayang mousenya kurang ergonomis.",Lebih dari 1 tahun lalu,Varian: Blue Mint
Rexus KM9 / KM-9 Combo Bundle Keyboard & Mouse Wireless - Pink,13,H***i,bintang 5,"Barang berkualitas dan sesuai deskripsi, semoga awet.",Lebih dari 1 tahun lalu,Varian: White
Rexus KM9 / KM-9 Combo Bundle Keyboard & Mouse Wireless - Pink,14,Dodo,bintang 5,packing rapi dan cepat sampai,Lebih dari 1 tahun lalu,Varian: White
Rexus KM9 / KM-9 Combo Bundle Keyboard & Mouse Wireless - Pink,15,Rahmat,bintang 5,Packing aman bekerja dengan baik,Lebih dari 1 tahun lalu,Varian: Blue Mint
Rexus KM9 / KM-9 Combo Bundle Keyboard & Mouse Wireless - Pink,16,M***n,bintang 5,bagus. pengemasan aman banget. produk sesuai dan cute banget. thanks,Lebih dari 1 tahun lalu,Varian: White
Rexus KM9 / KM-9 Combo Bundle Keyboard & Mouse Wireless - Pink,17,I***h,bintang 5,Keyboard berfungsi dgn baik dan luci bgt,Lebih dari 1 tahun lalu,Varian: Blue Mint
Rexus KM9 / KM-9 Combo Bundle Keyboard & Mouse Wireless - Pink,18,L***i,bintang 5,Manteppp uyyy,Lebih dari 1 tahun lalu,Varian: White
Rexus KM9 / KM-9 Combo Bundle Keyboard & Mouse Wireless - Pink,19,tato,bintang 5,"mantap hanya dalam 15 jam paketnya sdh sampe,packing rapih terima kasih ya...",Lebih dari 1 tahun lalu,Varian: White
Rexus KM9 / KM-9 Combo Bundle Keyboard & Mouse Wireless - Pink,20,Muhammad,bintang 5,none,Lebih dari 1 tahun lalu,Varian: White
Rexus KM9 / KM-9 Combo Bundle Keyboard & Mouse Wireless - Pink,21,R***y,bintang 5,nice,Lebih dari 1 tahun lalu,Varian: Blue Mint
Rexus KM9 / KM-9 Combo Bundle Keyboard & Mouse Wireless - Pink,22,Olivia,bintang 5,"Barang sudah sampai. Keyboardnya ada weightnya jadi rasanya kaya premium. Donglenya ada di dalam mouse, jadi kalau dicolokin ke laptop itu kedua-duanya udah connect. Agak...",Lebih dari 1 tahun lalu,Varian: Blue Mint
Rexus KM9 / KM-9 Combo Bundle Keyboard & Mouse Wireless - Pink,23,Annisa,bintang 5,"Terima kasih kak, barangnya aman sampai lokasi. Sukses GoodGamingShop 👍🏼",Lebih dari 1 tahun lalu,Varian: Blue Mint
Rexus KM9 / KM-9 Combo Bundle Keyboard & Mouse Wireless - Pink,24,Dimas,bintang 5,"Pengiriman cepat, packing aman, barang berfungsi dan sesuai deskripsi",Lebih dari 1 tahun lalu,Varian: White
Rexus KM9 / KM-9 Combo Bundle Keyboard & Mouse Wireless - Pink,25,Donnie,bintang 5,"Nice product! great build quality, worth for the money :D",Lebih dari 1 tahun lalu,Varian: White
Rexus KM9 / KM-9 Combo Bundle Keyboard & Mouse Wireless - Pink,26,Candra,bintang 5,dapat bonus btl minum....makasih ya,Lebih dari 1 tahun lalu,Varian: White
Rexus KM9 / KM-9 Combo Bundle Keyboard & Mouse Wireless - Pink,27,Parley,bintang 5,"seller fastres dan Ramah, pengirimwn cepet, packing Aman. brgnya ajibbb ga nyangka harga seginiiiii dpt barang yg lebih dr harganya. asliiiii keceeee, cute, unit, mewah",Lebih dari 1 tahun lalu,Varian: White
Rexus KM9 / KM-9 Combo Bundle Keyboard & Mouse Wireless - Pink,28,V***a,bintang 5,"seller ok, produk bagus, pengiriman tepat waktu",Lebih dari 1 tahun lalu,Varian: Blue Mint
Rexus KM9 / KM-9 Combo Bundle Keyboard & Mouse Wireless - Pink,29,a***a,bintang 5,none,Lebih dari 1 tahun lalu,Varian: White
Rexus KM9 / KM-9 Combo Bundle Keyboard & Mouse Wireless - Pink,30,s***t,bintang 5,👍,Lebih dari 1 tahun lalu,Varian: Pink
Rexus KM9 / KM-9 Combo Bundle Keyboard & Mouse Wireless - Pink,31,Muhamad,bintang 5,none,Lebih dari 1 tahun lalu,Varian: Blue Mint
Rexus KM9 / KM-9 Combo Bundle Keyboard & Mouse Wireless - Pink,32,Seruni,bintang 5,Barang sesuai dan berfungsi dengan baik. Awalnya agak tidak biasa karena tidak ada shift di sebelah kanan tapi setelah terbiasa no problem.,Lebih dari 1 tahun lalu,Varian: Blue Mint
Rexus KM9 / KM-9 Combo Bundle Keyboard & Mouse Wireless - Pink,33,b***i,bintang 4,"bagus, tidak terlalu ringan, tombol shift kanan tidak ada.",Lebih dari 1 tahun lalu,Varian: Blue Mint
Rexus KM9 / KM-9 Combo Bundle Keyboard & Mouse Wireless - Pink,34,a***a,bintang 5,"walaupun proses barang agak lama tapi overall service sangat baik, bahkan dapat bonus gantungan kunci, hal kecil tp memplihatkan kalo effort yg dikasih dari toko ini thou...",Lebih dari 1 tahun lalu,Varian: Blue Mint
Rexus KM9 / KM-9 Combo Bundle Keyboard & Mouse Wireless - Pink,35,Meiza,bintang 5,"keren dah keyboard nya, baru tau bisa diganti juga keycaps nya. Mantep dh",Lebih dari 1 tahun lalu,Varian: White
Rexus KM9 / KM-9 Combo Bundle Keyboard & Mouse Wireless - Pink,36,B***n,bintang 5,"Sempet ada yg kosong barangnya namun seller lgsg chat dan bisa di cancel, best-lah dikirim hari yg sama besoknya datang",Lebih dari 1 tahun lalu,Varian: Pink
Rexus KM9 / KM-9 Combo Bundle Keyboard & Mouse Wireless - Pink,37,M***a,bintang 5,Cute anet kata istri. Maacih ya,Lebih dari 1 tahun lalu,Varian: Blue Mint
Rexus KM9 / KM-9 Combo Bundle Keyboard & Mouse Wireless - Pink,38,shrnrhl,bintang 5,none,Lebih dari 1 tahun lalu,Varian: White
Rexus KM9 / KM-9 Combo Bundle Keyboard & Mouse Wireless - Pink,39,D***d,bintang 5,none,Lebih dari 1 tahun lalu,Varian: Blue Mint
Rexus KM9 / KM-9 Combo Bundle Keyboard & Mouse Wireless - Pink,40,Anonymous,bintang 5,good service....,Lebih dari 1 tahun lalu,Varian: White
