Nama Produk,Review,Nama Akun,Rating User,Ulasan Produk,Waktu Review,Varian Produk
SteelSeries Arctis 7 7.1 Wireless Gaming headset,1,R***i,bintang 5,Barang sesuai. Packing oke.,11 bulan lalu,Varian: Hitam
SteelSeries Arctis 7 7.1 Wireless Gaming headset,2,H***b,bintang 5,"berfungsi dengan baik, sangat worth it",Lebih dari 1 tahun lalu,Varian: Hitam
SteelSeries Arctis 7 7.1 Wireless Gaming headset,3,J***l,bintang 5,"Mantapp ygy, udah RO ke 2x nih servisan bagus pisan",Lebih dari 1 tahun lalu,Varian: Putih
SteelSeries Arctis 7 7.1 Wireless Gaming headset,4,A***a,bintang 5,"barang sesuai, packing aman, beli untuk hadiah suami hehe",Lebih dari 1 tahun lalu,Varian: Putih
SteelSeries Arctis 7 7.1 Wireless Gaming headset,5,k***s,bintang 5,barang bagus packing rapi seler ramah,Lebih dari 1 tahun lalu,Varian: Putih
SteelSeries Arctis 7 7.1 Wireless Gaming headset,6,Miftah,bintang 5,respon yg ramah dan baik hati .. makin sukses GGS,Lebih dari 1 tahun lalu,Varian: Hitam
SteelSeries Arctis 7 7.1 Wireless Gaming headset,7,irwan,bintang 5,Mantap,Lebih dari 1 tahun lalu,Varian: Hitam
SteelSeries Arctis 7 7.1 Wireless Gaming headset,8,yosefh,bintang 5,Earcupnya lembut. Best value headset. Sound mantap.,Lebih dari 1 tahun lalu,Varian: Putih
SteelSeries Arctis 7 7.1 Wireless Gaming headset,9,James,bintang 5,Earcupnya lembut. Sound mantap. Nyaman dan praktis tinggal plug and play.,Lebih dari 1 tahun lalu,Varian: Putih
SteelSeries Arctis 7 7.1 Wireless Gaming headset,10,D***o,bintang 5,Earcupnya lembut. Best value headset. Nyaman dan praktis tinggal plug and play. Sound mantap.,Lebih dari 1 tahun lalu,Varian: Hitam
SteelSeries Arctis 7 7.1 Wireless Gaming headset,11,Y***a,bintang 5,thank you kakk sudah sampai barangnya. perfect semua pokoknya.Best value headset. Earcupnya lembut.,Lebih dari 1 tahun lalu,Varian: Putih
SteelSeries Arctis 7 7.1 Wireless Gaming headset,12,dafa,bintang 5,"barangnya bagus, packaging nya tebel banget",Lebih dari 1 tahun lalu,Varian: Hitam
SteelSeries Arctis 7 7.1 Wireless Gaming headset,13,T***y,bintang 5,barang bagus,Lebih dari 1 tahun lalu,Varian: Hitam
SteelSeries Arctis 7 7.1 Wireless Gaming headset,14,A***k,bintang 5,Barang sdh diterima dg baik .. semoga awet,Lebih dari 1 tahun lalu,Varian: Putih
SteelSeries Arctis 7 7.1 Wireless Gaming headset,15,rangga,bintang 5,bgus,Lebih dari 1 tahun lalu,Varian: Hitam
SteelSeries Arctis 7 7.1 Wireless Gaming headset,16,Stefanus,bintang 5,none,Lebih dari 1 tahun lalu,Varian: Putih
SteelSeries Arctis 7 7.1 Wireless Gaming headset,17,Yosua,bintang 4,"Overlall barang oke, tapi ketika paket saya ambil buble warp ada yang sobek, untungnya barang barang saya gpp",Lebih dari 1 tahun lalu,Varian: Hitam
SteelSeries Arctis 7 7.1 Wireless Gaming headset,18,M***s,bintang 5,mantappu djiwa,Lebih dari 1 tahun lalu,Varian: Hitam
SteelSeries Arctis 7 7.1 Wireless Gaming headset,19,Willy,bintang 5,"Mantap betul, pengiriman cepat barang seperti di gambar rekomen seller deh",Lebih dari 1 tahun lalu,Varian: Putih
SteelSeries Arctis 7 7.1 Wireless Gaming headset,20,Eriz,bintang 5,"Kado buat suami. Pesan tanggal 27 Juli, 29 Juli nyampe. SiCepat emang ekspedisi paling kece. Alhamdulillah seller juga amanah. Barang sampai dengan utuh. Terima kasih ya...",Lebih dari 1 tahun lalu,Varian: Putih
SteelSeries Arctis 7 7.1 Wireless Gaming headset,21,A***u,bintang 5,Joss Gandos,Lebih dari 1 tahun lalu,Varian: Putih
SteelSeries Arctis 7 7.1 Wireless Gaming headset,22,D***l,bintang 5,bagus,Lebih dari 1 tahun lalu,Varian: Hitam
SteelSeries Arctis 7 7.1 Wireless Gaming headset,23,N***a,bintang 5,"barangnya datang sesuai pesanan, puas sama pelayanannya. adminnya fast respon 👍🏻",Lebih dari 1 tahun lalu,Varian: Putih
SteelSeries Arctis 7 7.1 Wireless Gaming headset,24,hendra,bintang 5,"mantap, recomended seller",Lebih dari 1 tahun lalu,Varian: Hitam
SteelSeries Arctis 7 7.1 Wireless Gaming headset,25,Evrin,bintang 5,mantaapp,Lebih dari 1 tahun lalu,Varian: Hitam
SteelSeries Arctis 7 7.1 Wireless Gaming headset,26,R***y,bintang 4,"overall good , tapinada sedikit di HS, acceptable",Lebih dari 1 tahun lalu,Varian: Putih
SteelSeries Arctis 7 7.1 Wireless Gaming headset,27,S***i,bintang 5,Mantap barang bagus dan pelayanan cepat dan rapi.. Thanks,Lebih dari 1 tahun lalu,Varian: Putih
SteelSeries Arctis 7 7.1 Wireless Gaming headset,28,D***i,bintang 5,bintang 5 pokok nya... top,Lebih dari 1 tahun lalu,Varian: Hitam
SteelSeries Arctis 7 7.1 Wireless Gaming headset,29,Muchlas,bintang 5,"excellent, reccommended seller. ga nyesel transaksi di toko ini 👍",Lebih dari 1 tahun lalu,Varian: Putih
SteelSeries Arctis 7 7.1 Wireless Gaming headset,30,A***i,bintang 5,barang sempat salah tapi seller merespons dengan cepat dan tanggap,Lebih dari 1 tahun lalu,Varian: Putih
SteelSeries Arctis 7 7.1 Wireless Gaming headset,31,Christian,bintang 5,mantap banget. admin ramah. dapet amplop thr lagi mayan wkkwkwkw. Makasih bro.,Lebih dari 1 tahun lalu,Varian: Hitam
SteelSeries Arctis 7 7.1 Wireless Gaming headset,32,O***r,bintang 5,Cakep. Semua berfungsi dengan baik. Thanks gan,Lebih dari 1 tahun lalu,Varian: Putih
SteelSeries Arctis 7 7.1 Wireless Gaming headset,33,F***y,bintang 5,asli GG Gaming banget cuiiiii,Lebih dari 1 tahun lalu,Varian: Hitam
SteelSeries Arctis 7 7.1 Wireless Gaming headset,34,Gilang,bintang 5,Mantap,Lebih dari 1 tahun lalu,Varian: Hitam
SteelSeries Arctis 7 7.1 Wireless Gaming headset,35,S***y,bintang 5,Respon cepat & ramah. Barang sesuai pesanan & berkualitas. Recommended seller 👍,Lebih dari 1 tahun lalu,Varian: Hitam
SteelSeries Arctis 7 7.1 Wireless Gaming headset,36,Ariyal,bintang 5,barang sampe dengan selamat,Lebih dari 1 tahun lalu,Varian: Putih
SteelSeries Arctis 7 7.1 Wireless Gaming headset,37,reynold,bintang 5,"Admin the best, jam 12 malem bales Fast respon, barang sudah pastti toppp🔥🔥🔥",Lebih dari 1 tahun lalu,Varian: Hitam
SteelSeries Arctis 7 7.1 Wireless Gaming headset,38,P***w,bintang 5,Barang mantap ini,Lebih dari 1 tahun lalu,Varian: Hitam
SteelSeries Arctis 7 7.1 Wireless Gaming headset,39,Stevie,bintang 5,"seller ramah, dan fast respon, barang packing rapih.",Lebih dari 1 tahun lalu,Varian: Hitam
SteelSeries Arctis 7 7.1 Wireless Gaming headset,40,f***i,bintang 5,none,Lebih dari 1 tahun lalu,Varian: Putih
SteelSeries Arctis 7 7.1 Wireless Gaming headset,41,Henry,bintang 5,Barang sesuai pesanan dan packaging rapih .. penjual sanget responsiv,Lebih dari 1 tahun lalu,Varian: Putih
SteelSeries Arctis 7 7.1 Wireless Gaming headset,42,A***t,bintang 5,mantab lah,Lebih dari 1 tahun lalu,Varian: Hitam
SteelSeries Arctis 7 7.1 Wireless Gaming headset,43,Aldy,bintang 5,"Barang sampe gak pake lama, bungkus rapih, and kualitas Arctic 7 gak sembarangan sesuai review2 di internet",Lebih dari 1 tahun lalu,Varian: Hitam
SteelSeries Arctis 7 7.1 Wireless Gaming headset,44,Zainun,bintang 5,"Mantap gan headsetnya, pengirimannya juga cepet",Lebih dari 1 tahun lalu,Varian: Hitam
SteelSeries Arctis 7 7.1 Wireless Gaming headset,45,Hafis,bintang 5,"Packing rapih mulus mantap barang juga mulusss banget, respon cepat dan tanggap, cuma gk ada stikernya padahal liat di review"" ada stikernya di dalemnya :(",Lebih dari 1 tahun lalu,Varian: Hitam
SteelSeries Arctis 7 7.1 Wireless Gaming headset,46,Andre,bintang 5,"Brgnya ok, pengirimannya jg cpt",Lebih dari 1 tahun lalu,none
SteelSeries Arctis 7 7.1 Wireless Gaming headset,47,Riph,bintang 5,Build quality bagus. Suara jernih. Kadang ada hissing sedikit kalau suara terlalu kencang.,Lebih dari 1 tahun lalu,none
SteelSeries Arctis 7 7.1 Wireless Gaming headset,48,Ryan,bintang 5,"Barang sangat2 oke,walau belum terbiasa dengan wireless nya.... Overall sangat okeee",Lebih dari 1 tahun lalu,none
