Nama Produk,Review,Nama Akun,Rating User,Ulasan Produk,Waktu Review,Varian Produk
Rexus Daxa Air 4 / Daxa AIr IV Gen 2 - Gaming Mouse,1,D***o,bintang 5,"Keren abiez, rawr XD",3 bulan lalu,Varian: Putih
Rexus Daxa Air 4 / Daxa AIr IV Gen 2 - Gaming Mouse,2,F***r,bintang 5,"Sesuai ekspektasi, good 👍",6 bulan lalu,Varian: Hitam
Rexus Daxa Air 4 / Daxa AIr IV Gen 2 - Gaming Mouse,3,Ary,bintang 5,none,6 bulan lalu,Varian: Putih
Rexus Daxa Air 4 / Daxa AIr IV Gen 2 - Gaming Mouse,4,Bima,bintang 5,"Mantep mousenya, cakep & clean. Semoga awet. pergi langsung di toko tapi belinya di tokped biar bisa ninggalin review.",10 bulan lalu,Varian: Hitam
Rexus Daxa Air 4 / Daxa AIr IV Gen 2 - Gaming Mouse,5,Andy,bintang 5,Mencoba upgrade mouse sebelumnya ke mouse ini hasil dari rekom admin seller yang super baik dan ramah. Semoga mouse ini bisa awet dan lebih baik dari mouse sebelumnya 👍,10 bulan lalu,Varian: Hitam
Rexus Daxa Air 4 / Daxa AIr IV Gen 2 - Gaming Mouse,6,Hermawan,bintang 5,none,11 bulan lalu,Varian: Hitam
Rexus Daxa Air 4 / Daxa AIr IV Gen 2 - Gaming Mouse,7,Hasyrul,bintang 5,bagus,Lebih dari 1 tahun lalu,Varian: Hitam
Rexus Daxa Air 4 / Daxa AIr IV Gen 2 - Gaming Mouse,8,M***o,bintang 5,"Beli untuk menggantikan Daxa air 2 saya yang lagi diganti switch nya, kondisi barang dan packaging 100%. TY GoodGamingShop 👍",Lebih dari 1 tahun lalu,Varian: Hitam
Rexus Daxa Air 4 / Daxa AIr IV Gen 2 - Gaming Mouse,9,Dimas,bintang 5,Mantap pokoknya,Lebih dari 1 tahun lalu,Varian: Hitam
Rexus Daxa Air 4 / Daxa AIr IV Gen 2 - Gaming Mouse,10,Ibnu,bintang 5,Mantap Mouse berfungsi sebagaimana mestinya 👍👍,Lebih dari 1 tahun lalu,Varian: Hitam
Rexus Daxa Air 4 / Daxa AIr IV Gen 2 - Gaming Mouse,11,Prastya,bintang 5,"barang bagus, mouse mulus, proses juga cepat, saya sudah sering beli di goodgamingshop, terpercaya pokoknya",Lebih dari 1 tahun lalu,Varian: Putih
Rexus Daxa Air 4 / Daxa AIr IV Gen 2 - Gaming Mouse,12,a***g,bintang 5,"Mouse berfungsi dengan baik + dapat free case bisa pilih warna, ukuran mouse besar jd nyaman buat palm grip. Untuk bobot mouse sangat ringan sesuai dengan deskripsi. adm...",Lebih dari 1 tahun lalu,Varian: Putih
Rexus Daxa Air 4 / Daxa AIr IV Gen 2 - Gaming Mouse,13,Surya,bintang 5,"dapet bonus cover skin nya lagi, mantep emang ggs ni",Lebih dari 1 tahun lalu,Varian: Putih
Rexus Daxa Air 4 / Daxa AIr IV Gen 2 - Gaming Mouse,14,Deo,bintang 5,Nyaman dan praktis tinggal plug and play Ukuran mouse pas ditangan. Best value mouse,Lebih dari 1 tahun lalu,Varian: Hitam
Rexus Daxa Air 4 / Daxa AIr IV Gen 2 - Gaming Mouse,15,A***a,bintang 5,Nyaman dan praktis tinggal plug and play Best value mouse Ukuran mouse pas ditangan.,Lebih dari 1 tahun lalu,Varian: Hitam
