Nama Produk,Review,Nama Akun,Rating User,Ulasan Produk,Waktu Review,Varian Produk
Noir OLV75 Barebone - 75% Wireless Barebone Keyboard,1,A***o,bintang 5,"Barang aman. Sesuai dengan deskripsi dapet lubenya dan udah dapet pe foamnya juga. Casenya dari aluminium, ga terlalu berat jadi masih ok. Dapet bonus stiker dari goodga...",Lebih dari 1 tahun lalu,none
Noir OLV75 Barebone - 75% Wireless Barebone Keyboard,2,V***e,bintang 5,"mantap seller ramah dan fast respon, barangnya juga aman semoga awet dan ga ada masalah keyboardnya",Lebih dari 1 tahun lalu,none
Noir OLV75 Barebone - 75% Wireless Barebone Keyboard,3,Huda,bintang 4,agak kecewa karena bilangnya di diskusi case almunium tau nya full plastik. but overall barebone nya bagus. ini pake - switch gateron milky yellow - keycaps honey and mi...,Lebih dari 1 tahun lalu,none
Noir OLV75 Barebone - 75% Wireless Barebone Keyboard,4,Danisworo,bintang 5,"Barang Oke banget, sesuai dan fast respon",Lebih dari 1 tahun lalu,none
Noir OLV75 Barebone - 75% Wireless Barebone Keyboard,5,g***o,bintang 5,Mantap,Lebih dari 1 tahun lalu,none
Noir OLV75 Barebone - 75% Wireless Barebone Keyboard,6,P***o,bintang 5,Solusi buat yang pengen rakit keyboard 75%,Lebih dari 1 tahun lalu,none
Noir OLV75 Barebone - 75% Wireless Barebone Keyboard,7,A***i,bintang 5,Pengiriman cpt banget brg smua oke dan bagus good job banget,Lebih dari 1 tahun lalu,none
Noir OLV75 Barebone - 75% Wireless Barebone Keyboard,8,A***s,bintang 5,barang sudah di terima dengan baik | Fast respone,Lebih dari 1 tahun lalu,none
Noir OLV75 Barebone - 75% Wireless Barebone Keyboard,9,A***i,bintang 5,Biarkan bintang yg berbicara !!,Lebih dari 1 tahun lalu,none
